{
  "schema_version": "1.0.0",
  "revision": 19,
  "last_scan_at": "2026-10-13T23:00:36+00:00",
  "items": [
    {
      "takeover_id": "GACR-T-84209d225086",
      "stalled_session_id": "session-c7c1466e55afb2e4da868944",
      "offered_to_session_id": null,
      "accepted_by_session_id": null,
      "status": "READY_FOR_RECONCILIATION",
      "created_at": "2026-10-02T06:56:10+00:00",
      "accepted_at": null,
      "work_item_id": null,
      "task_id": null,
      "branch": "main",
      "pull_request": null,
      "last_observed_head_sha": "854cc929b6d5d1b4fcd175c5c2c632c677da3ef7",
      "reconciled_head_sha": null,
      "active_claim_count": 0
    },
    {
      "takeover_id": "GACR-T-0b2ebe3f9ffa",
      "stalled_session_id": "session-68c97d4bb1ef71c86444de12",
      "offered_to_session_id": null,
      "accepted_by_session_id": null,
      "status": "READY_FOR_RECONCILIATION",
      "created_at": "2026-10-02T18:41:22+00:00",
      "accepted_at": null,
      "work_item_id": null,
      "task_id": null,
      "branch": "main",
      "pull_request": null,
      "last_observed_head_sha": "bb4ca1bb34bd14ac9f7e67f79bd78d4c2889a0dd",
      "reconciled_head_sha": null,
      "active_claim_count": 0
    },
    {
      "takeover_id": "GACR-T-2949090acdcf",
      "stalled_session_id": "session-02da2612b250e57ae361a588",
      "offered_to_session_id": null,
      "accepted_by_session_id": null,
      "status": "READY_FOR_RECONCILIATION",
      "created_at": "2026-10-02T18:41:22+00:00",
      "accepted_at": null,
      "work_item_id": null,
      "task_id": null,
      "branch": "main",
      "pull_request": null,
      "last_observed_head_sha": "5ef6dd2be14b0748854c3b9c2df915a35959eb95",
      "reconciled_head_sha": null,
      "active_claim_count": 0
    },
    {
      "takeover_id": "GACR-T-67770ae6b5a1",
      "stalled_session_id": "session-34e7d19d025442b07a4ad685",
      "offered_to_session_id": null,
      "accepted_by_session_id": null,
      "status": "READY_FOR_RECONCILIATION",
      "created_at": "2026-10-02T18:41:22+00:00",
      "accepted_at": null,
      "work_item_id": null,
      "task_id": null,
      "branch": "main",
      "pull_request": null,
      "last_observed_head_sha": "11f74caa476d56175dfd71676d9bdcab7c9bf1ed",
      "reconciled_head_sha": null,
      "active_claim_count": 0
    },
    {
      "takeover_id": "GACR-T-9f54e85f18ef",
      "stalled_session_id": "session-255e3c082a24a718c4cf3da6",
      "offered_to_session_id": null,
      "accepted_by_session_id": null,
      "status": "READY_FOR_RECONCILIATION",
      "created_at": "2026-10-02T18:41:22+00:00",
      "accepted_at": null,
      "work_item_id": null,
      "task_id": null,
      "branch": "main",
      "pull_request": null,
      "last_observed_head_sha": "7ad31377cab29b85be4fbf2145592fea398f0d05",
      "reconciled_head_sha": null,
      "active_claim_count": 0
    },
    {
      "takeover_id": "GACR-T-24e5d6224f6a",
      "stalled_session_id": "session-8e5ee7cff3ff8c157a8aee43",
      "offered_to_session_id": null,
      "accepted_by_session_id": null,
      "status": "READY_FOR_RECONCILIATION",
      "created_at": "2026-10-02T18:41:22+00:00",
      "accepted_at": null,
      "work_item_id": null,
      "task_id": null,
      "branch": "main",
      "pull_request": null,
      "last_observed_head_sha": "bb7c37bf6e1ecceb6d1e9554f114385c9f414170",
      "reconciled_head_sha": null,
      "active_claim_count": 0
    },
    {
      "takeover_id": "GACR-T-f99940da509b",
      "stalled_session_id": "session-4b5c18f24029b172733b09b2",
      "offered_to_session_id": null,
      "accepted_by_session_id": null,
      "status": "READY_FOR_RECONCILIATION",
      "created_at": "2026-10-02T18:41:22+00:00",
      "accepted_at": null,
      "work_item_id": null,
      "task_id": null,
      "branch": "governance/gscc-function-exposure-gate",
      "pull_request": 153,
      "last_observed_head_sha": "56d4c078b88936aa3fc972b12dd945aedf1df639",
      "reconciled_head_sha": null,
      "active_claim_count": 0
    },
    {
      "takeover_id": "GACR-T-6d9fad4c1749",
      "stalled_session_id": "session-36a6f3242b7c7fdd05bb6856",
      "offered_to_session_id": null,
      "accepted_by_session_id": null,
      "status": "READY_FOR_RECONCILIATION",
      "created_at": "2026-10-02T18:41:22+00:00",
      "accepted_at": null,
      "work_item_id": null,
      "task_id": null,
      "branch": "governance/gscc-observable-arrival-gateway",
      "pull_request": 152,
      "last_observed_head_sha": "46bfe2b09309d91bad0415d2b06189ccd91871af",
      "reconciled_head_sha": null,
      "active_claim_count": 0
    },
    {
      "takeover_id": "GACR-T-087a0ca2d13e",
      "stalled_session_id": "session-418b0b7e0f7348a2c6f16199",
      "offered_to_session_id": null,
      "accepted_by_session_id": null,
      "status": "READY_FOR_RECONCILIATION",
      "created_at": "2026-10-02T18:41:22+00:00",
      "accepted_at": null,
      "work_item_id": null,
      "task_id": null,
      "branch": "governance/gscc-universal-function-gate",
      "pull_request": 154,
      "last_observed_head_sha": "26fdf5c345ebe515fd2738cee85625bcfeac5e85",
      "reconciled_head_sha": null,
      "active_claim_count": 0
    },
    {
      "takeover_id": "GACR-T-e13c2bc16a95",
      "stalled_session_id": "session-e00ebd9473851afe1491889d",
      "offered_to_session_id": null,
      "accepted_by_session_id": null,
      "status": "READY_FOR_RECONCILIATION",
      "created_at": "2026-10-02T18:41:22+00:00",
      "accepted_at": null,
      "work_item_id": null,
      "task_id": null,
      "branch": "main",
      "pull_request": null,
      "last_observed_head_sha": "74eab5845aebdc1071099c054dbb1ad2b3929d0d",
      "reconciled_head_sha": null,
      "active_claim_count": 0
    },
    {
      "takeover_id": "GACR-T-548d084c4204",
      "stalled_session_id": "session-eb7721a3624dcbe969419a9c",
      "offered_to_session_id": null,
      "accepted_by_session_id": null,
      "status": "READY_FOR_RECONCILIATION",
      "created_at": "2026-10-02T18:41:22+00:00",
      "accepted_at": null,
      "work_item_id": null,
      "task_id": null,
      "branch": "governance/gscc-function-exposure-attestation",
      "pull_request": null,
      "last_observed_head_sha": "a7b543d36d21be05fd570ba9226be1f132a90b62",
      "reconciled_head_sha": null,
      "active_claim_count": 0
    },
    {
      "takeover_id": "GACR-T-4b536a8e1dc3",
      "stalled_session_id": "session-9e8a4d0c1a166f860b59ae36",
      "offered_to_session_id": null,
      "accepted_by_session_id": null,
      "status": "READY_FOR_RECONCILIATION",
      "created_at": "2026-10-02T18:41:22+00:00",
      "accepted_at": null,
      "work_item_id": null,
      "task_id": null,
      "branch": "governance/gscc-function-gate-consolidation",
      "pull_request": 156,
      "last_observed_head_sha": "a52876fc07c88701d73d622ce471c62eae1c455d",
      "reconciled_head_sha": null,
      "active_claim_count": 0
    },
    {
      "takeover_id": "GACR-T-f34e85e0e44f",
      "stalled_session_id": "session-cd76928899c1f94723609799",
      "offered_to_session_id": null,
      "accepted_by_session_id": null,
      "status": "READY_FOR_RECONCILIATION",
      "created_at": "2026-10-02T18:41:22+00:00",
      "accepted_at": null,
      "work_item_id": null,
      "task_id": null,
      "branch": "governance/gscc-entry-context-gate",
      "pull_request": 157,
      "last_observed_head_sha": "c7138e11db959d4d933b985362b2eb46489b1460",
      "reconciled_head_sha": null,
      "active_claim_count": 0
    },
    {
      "takeover_id": "GACR-T-7e1a63e31a04",
      "stalled_session_id": "session-8938f26e9ebba0bcfcaeffc2",
      "offered_to_session_id": null,
      "accepted_by_session_id": null,
      "status": "READY_FOR_RECONCILIATION",
      "created_at": "2026-10-02T18:41:22+00:00",
      "accepted_at": null,
      "work_item_id": null,
      "task_id": null,
      "branch": "governance/gscc-admission-access-gate",
      "pull_request": 158,
      "last_observed_head_sha": "4c9068d7eb16058fbd08b9be3f2e2fbfe7fbe1eb",
      "reconciled_head_sha": null,
      "active_claim_count": 0
    },
    {
      "takeover_id": "GACR-T-7b621caa68e5",
      "stalled_session_id": "session-f1e5bbceaca79bc8f31502c1",
      "offered_to_session_id": null,
      "accepted_by_session_id": null,
      "status": "READY_FOR_RECONCILIATION",
      "created_at": "2026-10-02T18:41:22+00:00",
      "accepted_at": null,
      "work_item_id": null,
      "task_id": null,
      "branch": "governance/gscc-admission-access-gate",
      "pull_request": 158,
      "last_observed_head_sha": "4c9068d7eb16058fbd08b9be3f2e2fbfe7fbe1eb",
      "reconciled_head_sha": null,
      "active_claim_count": 0
    },
    {
      "takeover_id": "GACR-T-cdbc965273f9",
      "stalled_session_id": "session-1d3690ef4e0581443cb35447",
      "offered_to_session_id": null,
      "accepted_by_session_id": null,
      "status": "READY_FOR_RECONCILIATION",
      "created_at": "2026-10-02T18:41:22+00:00",
      "accepted_at": null,
      "work_item_id": null,
      "task_id": null,
      "branch": "governance/gscc-admission-runtime",
      "pull_request": 159,
      "last_observed_head_sha": "fc3352732dad175acc3504754f10bf84ba5ea253",
      "reconciled_head_sha": null,
      "active_claim_count": 0
    },
    {
      "takeover_id": "GACR-T-d09e6e2635c5",
      "stalled_session_id": "session-ba6bc708096aa09f8991eb9d",
      "offered_to_session_id": null,
      "accepted_by_session_id": null,
      "status": "READY_FOR_RECONCILIATION",
      "created_at": "2026-10-02T18:41:22+00:00",
      "accepted_at": null,
      "work_item_id": null,
      "task_id": null,
      "branch": "governance/gscc-admission-postmerge-attestation",
      "pull_request": 160,
      "last_observed_head_sha": "1635d62da4eed77d7eb4bda87503735a3aa26a6d",
      "reconciled_head_sha": null,
      "active_claim_count": 0
    },
    {